{"approval":null,"release":"0.3.10","schema_version":"quarry.corpus-selection.v1","sources":[{"attestation_digest":null,"fixture_digest":null,"gate_id":"C-CORPUS-ATTEST","kind":"private","selected":false},{"attestation_digest":null,"fixture_digest":null,"gate_id":"C-CORPUS-RICH","kind":"private","selected":false},{"attestation_digest":null,"fixture_digest":null,"gate_id":"C-CORPUS-INTERRUPTED","kind":"private","selected":false},{"attestation_digest":null,"fixture_digest":null,"gate_id":"C-CORPUS-LEGACY","kind":"private","selected":false},{"attestation_digest":null,"fixture_digest":null,"gate_id":"C-CORPUS-ORPHAN","kind":"private","selected":false},{"attestation_digest":null,"fixture_digest":null,"gate_id":"C-CORPUS-EVOLUTION","kind":"private","selected":false},{"attestation_digest":null,"fixture_digest":null,"gate_id":"C-CORPUS-SYNTHETIC","kind":"synthetic","selected":true}]}
